{
  "product_name": "XBO 1000 W/HS OFR",
  "family_color_temperature_k": 6000.0,
  "family_power_min_w": 450.0,
  "family_power_max_w": 10000.0,
  "family_color_rendering_index_text": "Ra >",
  "application_areas": [
    "Klassische 35-mm-Filmprojektion",
    "Digitale Film- und Videoprojektion",
    "Architektur- und Effektlicht (\u201eLight Finger\u201c)",
    "Sonnensimulation"
  ],
  "product_family_benefits": [
    "Kurzbogen mit sehr hoher Leuchtdichte f\u00fcr hellere Leinwandausleuchtung",
    "Konstante Farbtemperatur von 6.000 K \u00fcber die gesamte Lebensdauer der Lampe",
    "Einfach zu warten",
    "Hohe Lichtbogenstabilit\u00e4t",
    "Sofort Licht auf der Leinwand dank Hei\u00dfwiederz\u00fcndungsfunktion",
    "Breiter Dimmbereich"
  ],
  "nominal_current_a": 50.0,
  "current_control_range_min_a": 30.0,
  "current_control_range_max_a": 55.0,
  "nominal_power_w": 1000.0,
  "nominal_voltage_v": 19.0,
  "diameter_mm": 40.0,
  "length_mm": 235.0,
  "length_with_base_without_pin_mm": 205.0,
  "light_center_length_lcl_mm": 95.0,
  "electrode_gap_cold_mm": 3.6,
  "product_weight_g": 255.0,
  "cable_length_mm": 0.0,
  "max_permissible_pinch_temperature_celsius": 230.0,
  "lifespan_h": 2000,
  "base_anode_standard_designation": "SFa27-11",
  "base_cathode_standard_designation": "SFcX27-8",
  "cooling": "Forciert",
  "burning_position": "s20/p20",
  "reach_declaration_date": "2023-03-10",
  "primary_product_eans": [
    "4008321082114",
    "4050300933566"
  ],
  "reach_candidate_substance_name": "Lead",
  "reach_candidate_substance_cas": "7439-92-1",
  "scip_numbers": [
    "22b5c075-11fc-41b0-ad60-dec034d8f30c"
  ],
  "country_specific_ean": "4008321082114",
  "metel_code": "OSRXBO1000HSOFR",
  "seg_number": null,
  "stk_number": null,
  "uk_org": null,
  "packaging_product_code": "4008321082114",
  "packaging_product_description": "XBO 1000 W/HS OFR Versandschachtel",
  "packaging_unit_pieces": 1,
  "packaging_dimension_length_mm": 410.0,
  "packaging_dimension_width_mm": 184.0,
  "packaging_dimension_height_mm": 180.0,
  "packaging_volume_dm3": 13.58,
  "packaging_gross_weight_g": 819.0,
  "content": "Produktfamilien-Vorteile\n_Kurzbogen mit sehr hoher Leuchtdichte f\u00fcr hellere Leinwandausleuchtung\n_Konstante Farbtemperatur von 6.000 K \u00fcber die gesamte Lebensdauer der Lampe\n_Einfach zu warten\n_Hohe Lichtbogenstabilit\u00e4t\n_Sofort Licht auf der Leinwand dank Hei\u00dfwiederz\u00fcndungsfunktion\n_Breiter Dimmbereich\nProduktfamilien-Eigenschaften\n_Farbtemperatur: ca. 6.000 K (Daylight)\n_Leistung: 450\u202610.000 W\n_Sehr guter Farbwiedergabeindex: Ra >\nProduktdatenblatt\n \nXBO 1000 W/HS OFR\nXBO for cinema projection | Xenon-Kurzbogenlampen 450\u202610.000\u00a0W\n Anwendungsgebiete\n_Klassische 35-mm-Filmprojektion\n_Digitale Film- und Videoprojektion\n_Architektur- und Effektlicht (\u201eLight Finger\u201c)\n_Sonnensimulation\n__\n8. Januar 2024, 22:14:04 \u00a9 2024, OSRAM GmbH. Alle Rechte vorbehalten.\nXBO 1000 W/HS OFR Seite 1 von 4Technische Daten\nElektrische Daten\nNennstrom 50 A\nStromsteuerbereich 30\u202655 A\nNennleistung 1000,00 W\nNennspannung 19,0 V\nAbmessungen & Gewicht\n \nDurchmesser 40,0 mm\nL\u00e4nge 235,0 mm\nL\u00e4nge mit Sockel jedoch ohne Sockelstift 205,00 mm\nAbstand Lichtschwerpunkt (LCL) 95,0 mm 1)\nElektrodenabstand kalt 3,6 mm\nProduktgewicht 255,00 g\n1) Abstand Sockelboden zu Elektrodenspitze (kalt)\nTemperaturen & Betriebsbedingungen\nMax. zul\u00e4ssige Umgebungstemp. Quetschung 230 \u00b0C\nLebensdauer\nLebensdauer 2000 h\nService Warranty Lifetime 3000 h\nZus\u00e4tzliche Produktdaten\nSockel Anode (Normbezeichnung) SFa27-11\nSockel Kathode (Normbezeichnung) SFcX27-8\nAnmerkung zum Produkt OFR = Ozon-freie Version/H = horizontale Brennlage/S\n= kurze Bauform (short)Produktdatenblatt\n__\n8. Januar 2024, 22:14:04 \u00a9 2024, OSRAM GmbH. Alle Rechte vorbehalten.\nXBO 1000 W/HS OFR Seite 2 von 4Einsatzm\u00f6glichkeiten\nK\u00fchlung Forciert  1)\nBrennstellung s20/p20  2)\n1) vertikal und horizontal\n2) bei vertikaler Brennlage: Anode (+) oben\nUmwelt Informationen\nInformationen gem\u00e4\u00df Art. 33 der EU Richtlinie (EC) 1907/2006 (REACh)\nDatum der Deklaration 10-03-2023\nPrim\u00e4re Erzeugnisnummer 4008321082114 | 4050300933566\nStoff der Kandidatenliste 1 Lead\nCAS Nr. des Stoffes 1 7439-92-1\nInformationen zum sicheren Gebrauch Die Bezeichnung des Stoffes der Kandidatenliste\nreicht aus f\u00fcr den sicheren Gebrauch des Produktes.\nSCIP Deklarationsnummer 22b5c075-11fc-41b0-ad60-dec034d8f30c\nL\u00e4nderspezifische Informationen\nEAN METEL-Code SEG-No. STK-Number UK Org\n4008321082114 OSRXBO1000HSOFR - - -Produktdatenblatt\n__\n8. Januar 2024, 22:14:04 \u00a9 2024, OSRAM GmbH. Alle Rechte vorbehalten.\nXBO 1000 W/HS OFR Seite 3 von 4Verpackungsinformationen\nProdukt-Code Produkt-\nBezeichnungVerpackungseinheit\n(St\u00fcck pro Einheit)Abmessungen\n(L\u00e4nge x Breite x\nH\u00f6he)Volumen Gewicht brutto\n4008321082114 XBO 1000 W/HS OFR Versandschachtel\n1410 mm x 184 mm x\n180 mm13.58 dm\u00b3 819.00 g\nDie genannten Produktnummern beschreiben die kleinste bestellbare Mengeneinheit. Eine Versandeinheit kann mehrere\nEinzelprodukte beinhalten. Als Bestellmenge verwenden Sie bitte das Ein- oder Mehrfache einer Versandeinheit.\nHaftungsausschluss\n\u00c4nderungen und Irrt\u00fcmer vorbehalten. Vergewissern Sie sich, dass Sie immer den neuesten Stand verwenden.Produktdatenblatt\n__\n8. Januar 2024, 22:14:04 \u00a9 2024, OSRAM GmbH. Alle Rechte vorbehalten.\nXBO 1000 W/HS OFR Seite 4 von 4"
}