{
  "product_name": "XBO 10000 W/HS OFR",
  "family_color_temperature_k": 6000.0,
  "family_power_min_w": 450.0,
  "family_power_max_w": 10000.0,
  "family_color_rendering_index_text": "Ra >",
  "application_areas": [
    "Klassische 35-mm-Filmprojektion",
    "Digitale Film- und Videoprojektion",
    "Architektur- und Effektlicht (\u201eLight Finger\u201c)",
    "Sonnensimulation"
  ],
  "product_family_benefits": [
    "Kurzbogen mit sehr hoher Leuchtdichte f\u00fcr hellere Leinwandausleuchtung",
    "Konstante Farbtemperatur von 6.000 K \u00fcber die gesamte Lebensdauer der Lampe",
    "Einfach zu warten",
    "Hohe Lichtbogenstabilit\u00e4t",
    "Sofort Licht auf der Leinwand dank Hei\u00dfwiederz\u00fcndungsfunktion",
    "Breiter Dimmbereich"
  ],
  "nominal_current_a": 195.0,
  "current_control_range_min_a": 160.0,
  "current_control_range_max_a": 200.0,
  "nominal_power_w": 10000.0,
  "nominal_voltage_v": 50.0,
  "diameter_mm": 90.0,
  "length_mm": 436.0,
  "length_with_base_without_pin_mm": 393.0,
  "light_center_length_lcl_mm": 170.5,
  "electrode_gap_cold_mm": 13.5,
  "product_weight_g": 1030.0,
  "cable_length_mm": 400.0,
  "max_permissible_pinch_temperature_celsius": 230.0,
  "lifespan_h": 300,
  "base_anode_standard_designation": "SFaX30-9.5",
  "base_cathode_standard_designation": "SFa30-7.9",
  "cooling": "Forciert",
  "burning_position": "s15/p15",
  "reach_declaration_date": "2023-08-18",
  "primary_product_eans": [
    "4050300624532",
    "4008321552327",
    "4062172030724"
  ],
  "reach_candidate_substance_name": "Lead",
  "reach_candidate_substance_cas": "7439-92-1",
  "scip_numbers": [
    "7934C4E7-AD5D-4E20-9BAA-2349E600F6AD",
    "cb26f713-f336-4c5c-b8f4-f0f8d52a0f47"
  ],
  "packaging_product_code": "4062172030724",
  "packaging_product_description": "XBO 10000 W/HS\nOFRVersandschachtel",
  "packaging_unit_pieces": 1,
  "packaging_dimension_length_mm": 590.0,
  "packaging_dimension_width_mm": 234.0,
  "packaging_dimension_height_mm": 234.0,
  "packaging_volume_dm3": 32.31,
  "packaging_gross_weight_g": 2179.0,
  "content": "Produktfamilien-Vorteile\n_Kurzbogen mit sehr hoher Leuchtdichte f\u00fcr hellere Leinwandausleuchtung\n_Konstante Farbtemperatur von 6.000 K \u00fcber die gesamte Lebensdauer der Lampe\n_Einfach zu warten\n_Hohe Lichtbogenstabilit\u00e4t\n_Sofort Licht auf der Leinwand dank Hei\u00dfwiederz\u00fcndungsfunktion\n_Breiter Dimmbereich\nProduktfamilien-Eigenschaften\n_Farbtemperatur: ca. 6.000 K (Daylight)\n_Leistung: 450\u202610.000 W\n_Sehr guter Farbwiedergabeindex: Ra >\nProduktdatenblatt\n \nXBO 10000 W/HS OFR\nXBO for cinema projection | Xenon-Kurzbogenlampen 450\u202610.000\u00a0W\n Anwendungsgebiete\n_Klassische 35-mm-Filmprojektion\n_Digitale Film- und Videoprojektion\n_Architektur- und Effektlicht (\u201eLight Finger\u201c)\n_Sonnensimulation\n__\n7. Januar 2024, 20:18:27 \u00a9 2024, OSRAM GmbH. Alle Rechte vorbehalten.\nXBO 10000 W/HS OFR Seite 1 von 4Technische Daten\nElektrische Daten\nNennstrom 195,00 A\nStromsteuerbereich 160\u2026200 A\nNennleistung 10000,00 W\nNennspannung 50,0 V\nAbmessungen & Gewicht\n \nDurchmesser 90,0 mm\nL\u00e4nge 436,0 mm\nL\u00e4nge mit Sockel jedoch ohne Sockelstift 393,00 mm\nAbstand Lichtschwerpunkt (LCL) 170,5 mm 1)\nElektrodenabstand kalt 13,5 mm\nProduktgewicht 1030,00 g\nKabell\u00e4nge 400,0\n1) Abstand Sockelboden zu Elektrodenspitze (kalt)\nTemperaturen & Betriebsbedingungen\nMax. zul\u00e4ssige Umgebungstemp. Quetschung 230 \u00b0C\nLebensdauer\nLebensdauer 300 h\nService Warranty Lifetime 400 h\nZus\u00e4tzliche Produktdaten\nSockel Anode (Normbezeichnung) SFaX30-9.5\nSockel Kathode (Normbezeichnung) SFa30-7.9Produktdatenblatt\n__\n7. Januar 2024, 20:18:27 \u00a9 2024, OSRAM GmbH. Alle Rechte vorbehalten.\nXBO 10000 W/HS OFR Seite 2 von 4Anmerkung zum Produkt OFR = Ozon-freie Version/H = horizontale Brennlage/S\n= kurze Bauform (short)\nEinsatzm\u00f6glichkeiten\nK\u00fchlung Forciert  1)\nBrennstellung s15/p15  2)\n1) vertikal und horizontal\n2) bei vertikaler Brennlage: Anode (+) oben\nUmwelt Informationen\nInformationen gem\u00e4\u00df Art. 33 der EU Richtlinie (EC) 1907/2006 (REACh)\nDatum der Deklaration 18-08-2023\nPrim\u00e4re Erzeugnisnummer 4050300624532 | 4008321552327 | 4062172030724\nStoff der Kandidatenliste 1 Lead\nCAS Nr. des Stoffes 1 7439-92-1\nInformationen zum sicheren Gebrauch Die Bezeichnung des Stoffes der Kandidatenliste\nreicht aus f\u00fcr den sicheren Gebrauch des Produktes.\nSCIP Deklarationsnummer 7934C4E7-AD5D-4E20-9BAA-2349E600F6AD |  |\ncb26f713-f336-4c5c-b8f4-f0f8d52a0f47Produktdatenblatt\n__\n7. Januar 2024, 20:18:27 \u00a9 2024, OSRAM GmbH. Alle Rechte vorbehalten.\nXBO 10000 W/HS OFR Seite 3 von 4Verpackungsinformationen\nProdukt-Code Produkt-\nBezeichnungVerpackungseinheit\n(St\u00fcck pro Einheit)Abmessungen\n(L\u00e4nge x Breite x\nH\u00f6he)Volumen Gewicht brutto\n4062172030724 XBO 10000 W/HS\nOFRVersandschachtel\n1590 mm x 234 mm x\n234 mm32.31 dm\u00b3 2179.00 g\nDie genannten Produktnummern beschreiben die kleinste bestellbare Mengeneinheit. Eine Versandeinheit kann mehrere\nEinzelprodukte beinhalten. Als Bestellmenge verwenden Sie bitte das Ein- oder Mehrfache einer Versandeinheit.\nHaftungsausschluss\n\u00c4nderungen und Irrt\u00fcmer vorbehalten. Vergewissern Sie sich, dass Sie immer den neuesten Stand verwenden.Produktdatenblatt\n__\n7. Januar 2024, 20:18:27 \u00a9 2024, OSRAM GmbH. Alle Rechte vorbehalten.\nXBO 10000 W/HS OFR Seite 4 von 4"
}