{
  "product_name": "XBO 2000 W/HTP XL OFR",
  "family_color_temperature_k": 6000.0,
  "family_power_min_w": 450.0,
  "family_power_max_w": 10000.0,
  "family_color_rendering_index_text": "Ra >",
  "application_areas": [
    "Klassische 35-mm-Filmprojektion",
    "Digitale Film- und Videoprojektion",
    "Architektur- und Effektlicht (\u201eLight Finger\u201c)",
    "Sonnensimulation"
  ],
  "product_family_benefits": [
    "Kurzbogen mit sehr hoher Leuchtdichte f\u00fcr hellere Leinwandausleuchtung",
    "Konstante Farbtemperatur von 6.000 K \u00fcber die gesamte Lebensdauer der Lampe",
    "Einfach zu warten",
    "Hohe Lichtbogenstabilit\u00e4t",
    "Sofort Licht auf der Leinwand dank Hei\u00dfwiederz\u00fcndungsfunktion",
    "Breiter Dimmbereich"
  ],
  "nominal_current_a": 70.0,
  "current_control_range_min_a": 50.0,
  "current_control_range_max_a": 85.0,
  "nominal_power_w": 2000.0,
  "nominal_voltage_v": 28.0,
  "diameter_mm": 52.0,
  "length_mm": 375.0,
  "length_with_base_without_pin_mm": 322.0,
  "light_center_length_lcl_mm": 142.5,
  "electrode_gap_cold_mm": 5.8,
  "product_weight_g": 452.0,
  "cable_length_mm": -1.0,
  "max_permissible_pinch_temperature_celsius": 230.0,
  "lifespan_h": 3500,
  "base_anode_standard_designation": "SFa25-14",
  "base_cathode_standard_designation": "SFc25-14",
  "cooling": "Forciert",
  "burning_position": "s30/p30",
  "reach_declaration_date": "2022-12-09",
  "primary_product_eans": [
    "4008321244031",
    "4008321650429"
  ],
  "reach_candidate_substance_name": "Lead",
  "reach_candidate_substance_cas": "7439-92-1",
  "scip_numbers": [
    "6289c378-8cb7-40d8-bd67-f74e947878c5"
  ],
  "country_specific_ean": "4008321244031",
  "metel_code": "OSRXBO2000HTPXL",
  "seg_number": null,
  "stk_number": null,
  "uk_org": null,
  "packaging_product_code": "4008321244031",
  "packaging_product_description": "XBO 2000 W/HTP XL\nOFRVersandschachtel",
  "packaging_unit_pieces": 1,
  "packaging_dimension_length_mm": 590.0,
  "packaging_dimension_width_mm": 234.0,
  "packaging_dimension_height_mm": 229.0,
  "packaging_volume_dm3": 31.62,
  "packaging_gross_weight_g": 1452.0,
  "content": "Produktfamilien-Vorteile\n_Kurzbogen mit sehr hoher Leuchtdichte f\u00fcr hellere Leinwandausleuchtung\n_Konstante Farbtemperatur von 6.000 K \u00fcber die gesamte Lebensdauer der Lampe\n_Einfach zu warten\n_Hohe Lichtbogenstabilit\u00e4t\n_Sofort Licht auf der Leinwand dank Hei\u00dfwiederz\u00fcndungsfunktion\n_Breiter Dimmbereich\nProduktfamilien-Eigenschaften\n_Farbtemperatur: ca. 6.000 K (Daylight)\n_Leistung: 450\u202610.000 W\n_Sehr guter Farbwiedergabeindex: Ra >\nProduktdatenblatt\n \nXBO 2000 W/HTP XL OFR\nXBO for cinema projection | Xenon-Kurzbogenlampen 450\u202610.000\u00a0W\n Anwendungsgebiete\n_Klassische 35-mm-Filmprojektion\n_Digitale Film- und Videoprojektion\n_Architektur- und Effektlicht (\u201eLight Finger\u201c)\n_Sonnensimulation\n__\n8. Januar 2024, 22:14:04 \u00a9 2024, OSRAM GmbH. Alle Rechte vorbehalten.\nXBO 2000 W/HTP XL OFR Seite 1 von 4Technische Daten\nElektrische Daten\nNennstrom 70,00 A\nStromsteuerbereich 50\u202685 A\nNennleistung 2000,00 W\nNennspannung 28,0 V\nAbmessungen & Gewicht\n \nDurchmesser 52,0 mm\nL\u00e4nge 375,0 mm\nL\u00e4nge mit Sockel jedoch ohne Sockelstift 322,00 mm\nAbstand Lichtschwerpunkt (LCL) 142,5 mm 1)\nKabel-/Leitungsl\u00e4nge, Eingangsseite -\nElektrodenabstand kalt 5,8 mm\nProduktgewicht 452,00 g\n1) Abstand Sockelboden zu Elektrodenspitze (kalt)\nTemperaturen & Betriebsbedingungen\nMax. zul\u00e4ssige Umgebungstemp. Quetschung 230 \u00b0C\nLebensdauer\nLebensdauer 3500 h\nZus\u00e4tzliche Produktdaten\nSockel Anode (Normbezeichnung) SFa25-14\nSockel Kathode (Normbezeichnung) SFc25-14\nEinsatzm\u00f6glichkeitenProduktdatenblatt\n__\n8. Januar 2024, 22:14:04 \u00a9 2024, OSRAM GmbH. Alle Rechte vorbehalten.\nXBO 2000 W/HTP XL OFR Seite 2 von 4K\u00fchlung Forciert\nBrennstellung s30/p30  1)\n1) bei vertikaler Brennlage: Anode (+) oben\nUmwelt Informationen\nInformationen gem\u00e4\u00df Art. 33 der EU Richtlinie (EC) 1907/2006 (REACh)\nDatum der Deklaration 09-12-2022\nPrim\u00e4re Erzeugnisnummer 4008321244031 | 4008321650429\nStoff der Kandidatenliste 1 Lead\nCAS Nr. des Stoffes 1 7439-92-1\nInformationen zum sicheren Gebrauch Die Bezeichnung des Stoffes der Kandidatenliste\nreicht aus f\u00fcr den sicheren Gebrauch des Produktes.\nSCIP Deklarationsnummer 6289c378-8cb7-40d8-bd67-f74e947878c5\nL\u00e4nderspezifische Informationen\nEAN METEL-Code SEG-No. STK-Number UK Org\n4008321244031 OSRXBO2000HTPXL - - -Produktdatenblatt\n__\n8. Januar 2024, 22:14:04 \u00a9 2024, OSRAM GmbH. Alle Rechte vorbehalten.\nXBO 2000 W/HTP XL OFR Seite 3 von 4Verpackungsinformationen\nProdukt-Code Produkt-\nBezeichnungVerpackungseinheit\n(St\u00fcck pro Einheit)Abmessungen\n(L\u00e4nge x Breite x\nH\u00f6he)Volumen Gewicht brutto\n4008321244031 XBO 2000 W/HTP XL\nOFRVersandschachtel\n1590 mm x 234 mm x\n229 mm31.62 dm\u00b3 1452.00 g\n4008321650429 XBO 2000 W/HTP XL\nOFRVersandschachtel\n1590 mm x 234 mm x\n229 mm31.62 dm\u00b3 1538.00 g\nDie genannten Produktnummern beschreiben die kleinste bestellbare Mengeneinheit. Eine Versandeinheit kann mehrere\nEinzelprodukte beinhalten. Als Bestellmenge verwenden Sie bitte das Ein- oder Mehrfache einer Versandeinheit.\nHaftungsausschluss\n\u00c4nderungen und Irrt\u00fcmer vorbehalten. Vergewissern Sie sich, dass Sie immer den neuesten Stand verwenden.Produktdatenblatt\n__\n8. Januar 2024, 22:14:04 \u00a9 2024, OSRAM GmbH. Alle Rechte vorbehalten.\nXBO 2000 W/HTP XL OFR Seite 4 von 4"
}